{
  "$schema": "https://json-schema.org/draft/2020-12/schema",
  "$id": "https://formspec.org/schemas/issuer/1.0",
  "title": "Formspec Issuer Document",
  "description": "A standalone sidecar declaring who is asking the form. One Issuer publishes many Definitions. Definitions point OUT to Issuer (inverse cardinality of locale/references/ontology). Receipt-side displayedIssuer pins the resolved Issuer at submit-time inside the signed-payload preimage.",
  "type": "object",
  "additionalProperties": false,
  "required": ["$formspecIssuer", "url", "version", "name", "kind"],
  "allOf": [
    {
      "$ref": "https://formspec.org/schemas/common/1.0#/$defs/Party"
    }
  ],
  "properties": {
    "$formspecIssuer": {
      "type": "string",
      "const": "1.0",
      "description": "Sidecar version pin.",
      "examples": ["1.0"],
      "x-lm": {
        "critical": true,
        "intent": "Version pin."
      }
    },
    "$schema": {
      "type": "string",
      "format": "uri"
    },
    "url": {
      "type": "string",
      "format": "uri",
      "description": "Canonical URL of this Issuer document (distinct from Party.homepage)."
    },
    "version": {
      "type": "string",
      "pattern": "^(0|[1-9]\\d*)\\.(0|[1-9]\\d*)\\.(0|[1-9]\\d*)(\\+sha256-[0-9a-f]{64})?$",
      "description": "Semver, optionally suffixed with +sha256-<hex> for content-hash invalidation."
    },
    "name": {
      "oneOf": [
        {
          "type": "string"
        },
        {
          "$ref": "https://formspec.org/schemas/common/1.0#/$defs/LangMap"
        }
      ]
    },
    "kind": {
      "type": "string",
      "enum": ["organization", "department", "program", "individual"],
      "description": "Issuer UI-tier role; not WOS scope-tier Organization (ADR 0146).",
      "examples": ["department"],
      "x-lm": {
        "critical": true,
        "intent": "UI-tier role; not WOS scope-tier Organization (ADR 0146)."
      }
    },
    "displayName": {
      "oneOf": [
        {
          "type": "string"
        },
        {
          "$ref": "https://formspec.org/schemas/common/1.0#/$defs/LangMap"
        }
      ]
    },
    "shortName": {
      "oneOf": [
        {
          "type": "string"
        },
        {
          "$ref": "https://formspec.org/schemas/common/1.0#/$defs/LangMap"
        }
      ]
    },
    "identifier": {
      "type": "string",
      "format": "uri"
    },
    "homepage": {
      "type": "string",
      "format": "uri"
    },
    "parentOrganization": {
      "type": "string",
      "format": "uri",
      "description": "URL of the parent Issuer document. Linear chain; no nesting."
    },
    "organizationName": {
      "oneOf": [
        {
          "type": "string"
        },
        {
          "$ref": "https://formspec.org/schemas/common/1.0#/$defs/LangMap"
        }
      ]
    },
    "departmentName": {
      "oneOf": [
        {
          "type": "string"
        },
        {
          "$ref": "https://formspec.org/schemas/common/1.0#/$defs/LangMap"
        }
      ]
    },
    "jurisdiction": {
      "type": "object",
      "additionalProperties": false,
      "required": ["level", "name"],
      "properties": {
        "level": {
          "type": "string",
          "enum": [
            "federal",
            "state",
            "county",
            "municipal",
            "tribal",
            "international",
            "private",
            "individual"
          ]
        },
        "name": {
          "type": "string"
        },
        "code": {
          "type": "string",
          "description": "ISO 3166-1 alpha-2 for international; ISO 3166-2 for state; jurisdiction-specific below."
        }
      }
    },
    "defaultLanguage": {
      "type": "string",
      "pattern": "^[a-zA-Z]{2,3}(-[a-zA-Z0-9]{2,8})*$",
      "default": "en"
    },
    "logo": {
      "type": "object",
      "additionalProperties": false,
      "properties": {
        "primary": {
          "$ref": "#/$defs/LogoVariant"
        },
        "wordmark": {
          "$ref": "#/$defs/LogoVariant"
        },
        "monochrome": {
          "$ref": "#/$defs/LogoVariant"
        }
      }
    },
    "contactPoint": {
      "oneOf": [
        {
          "$ref": "https://formspec.org/schemas/common/1.0#/$defs/ContactPoint"
        },
        {
          "type": "array",
          "items": {
            "$ref": "https://formspec.org/schemas/common/1.0#/$defs/ContactPoint"
          }
        }
      ]
    },
    "extensions": {
      "$ref": "https://formspec.org/schemas/common/1.0#/$defs/Extensions"
    }
  },
  "$defs": {
    "LogoVariant": {
      "type": "object",
      "additionalProperties": false,
      "required": ["url"],
      "properties": {
        "url": {
          "type": "string",
          "format": "uri"
        },
        "altText": {
          "oneOf": [
            {
              "type": "string"
            },
            {
              "$ref": "https://formspec.org/schemas/common/1.0#/$defs/LangMap"
            }
          ]
        },
        "aspectRatio": {
          "type": "string",
          "pattern": "^\\d+:\\d+$"
        },
        "preferredBackground": {
          "type": "string",
          "enum": ["light", "dark", "any"]
        }
      }
    }
  }
}
